{
  "$defs": {
    "EvidenceArtifactRef": {
      "additionalProperties": false,
      "properties": {
        "digest": {
          "pattern": "^sha256:[0-9a-f]{64}$",
          "title": "Digest",
          "type": "string"
        },
        "logical_name": {
          "minLength": 1,
          "title": "Logical Name",
          "type": "string"
        },
        "media_type": {
          "minLength": 1,
          "title": "Media Type",
          "type": "string"
        },
        "relative_path": {
          "minLength": 1,
          "title": "Relative Path",
          "type": "string"
        },
        "size_bytes": {
          "minimum": 0,
          "title": "Size Bytes",
          "type": "integer"
        }
      },
      "required": [
        "logical_name",
        "media_type",
        "digest",
        "size_bytes",
        "relative_path"
      ],
      "title": "EvidenceArtifactRef",
      "type": "object"
    }
  },
  "$id": "urn:pmorg:contract:pmorg.task.record-progress/v1",
  "$schema": "https://json-schema.org/draft/2020-12/schema",
  "additionalProperties": false,
  "properties": {
    "progress_code": {
      "minLength": 1,
      "title": "Progress Code",
      "type": "string"
    },
    "run_id": {
      "format": "uuid",
      "title": "Run Id",
      "type": "string"
    },
    "schema_version": {
      "const": "pmorg.task.record-progress/v1",
      "title": "Schema Version",
      "type": "string"
    },
    "summary_ref": {
      "$ref": "#/$defs/EvidenceArtifactRef"
    },
    "task_id": {
      "exclusiveMinimum": 0,
      "title": "Task Id",
      "type": "integer"
    }
  },
  "required": [
    "schema_version",
    "task_id",
    "run_id",
    "progress_code",
    "summary_ref"
  ],
  "title": "TaskRecordProgressPayload",
  "type": "object",
  "x-pmorg-schema-version": "pmorg.task.record-progress/v1",
  "x-pmorg-wire-surface": "pmorg-contracts/1.0"
}
