{
  "progress_code": "example",
  "run_id": "01900000-0000-7000-8000-000000000001",
  "schema_version": "pmorg.task.record-progress/v1",
  "summary_ref": {
    "digest": "sha256:0000000000000000000000000000000000000000000000000000000000000000",
    "logical_name": "example",
    "media_type": "application/json",
    "relative_path": "evidence/example.json",
    "size_bytes": 1
  },
  "task_id": 1
}
